

================================================================
== Vitis HLS Report for 'cipher_Pipeline_VITIS_LOOP_85_1_VITIS_LOOP_86_2'
================================================================
* Date:           Thu Nov  6 13:35:40 2025

* Version:        2021.1 (Build 3247384 on Thu Jun 10 19:36:07 MDT 2021)
* Project:        tmp_hls_smoke_debug
* Solution:       solution1 (Vivado IP Flow Target)
* Product family: virtexuplus
* Target device:  xcvu9p-flga2104-2L-e


================================================================
== Performance Estimates
================================================================
+ Timing: 
    * Summary: 
    +--------+----------+----------+------------+
    |  Clock |  Target  | Estimated| Uncertainty|
    +--------+----------+----------+------------+
    |ap_clk  |  10.00 ns|  2.225 ns|     2.70 ns|
    +--------+----------+----------+------------+

+ Latency: 
    * Summary: 
    +---------+---------+----------+----------+-----+-----+---------+
    |  Latency (cycles) |  Latency (absolute) |  Interval | Pipeline|
    |   min   |   max   |    min   |    max   | min | max |   Type  |
    +---------+---------+----------+----------+-----+-----+---------+
    |       19|       19|  0.190 us|  0.190 us|   19|   19|       no|
    +---------+---------+----------+----------+-----+-----+---------+

    + Detail: 
        * Instance: 
        N/A

        * Loop: 
        +-----------------------------------+---------+---------+----------+-----------+-----------+------+----------+
        |                                   |  Latency (cycles) | Iteration|  Initiation Interval  | Trip |          |
        |             Loop Name             |   min   |   max   |  Latency |  achieved |   target  | Count| Pipelined|
        +-----------------------------------+---------+---------+----------+-----------+-----------+------+----------+
        |- VITIS_LOOP_85_1_VITIS_LOOP_86_2  |       17|       17|         3|          1|          1|    16|       yes|
        +-----------------------------------+---------+---------+----------+-----------+-----------+------+----------+

============================================================
+ Verbose Summary: Synthesis Manager
============================================================
InlineROM: 1
ExposeGlobal: 0
============================================================
+ Verbose Summary: CDFG Model
============================================================
IsTopModel: 0
ResetActiveHigh: 1
IsCombinational: 0
IsDatapathOnly: 0
HasWiredReturn: 1
HasMFsm: 2
HasVarLatency: 1
IsPipeline: 0
IsRtlPipelined: 0
IsInstanceOverlapped: 0
IsDontTouch: 0
HasImplIP: 0
IsGatedGlobalClock: 0

+ Individual pipeline summary: 
  * Pipeline-0: initiation interval (II) = 1, depth = 3


============================================================
+ Verbose Summary: Schedule
============================================================
* Number of FSM states : 3
* Pipeline : 1
  Pipeline-0 : II = 1, D = 3, States = { 1 2 3 }
* Dataflow Pipeline: 0

* FSM state transitions: 
1 --> 2 
2 --> 3 
3 --> 

* FSM state operations: 

State 1 <SV = 0> <Delay = 2.22>
ST_1 : Operation 6 [1/1] (0.00ns)   --->   "%j = alloca i32 1"   --->   Operation 6 'alloca' 'j' <Predicate = true> <Delay = 0.00>
ST_1 : Operation 7 [1/1] (0.00ns)   --->   "%i = alloca i32 1"   --->   Operation 7 'alloca' 'i' <Predicate = true> <Delay = 0.00>
ST_1 : Operation 8 [1/1] (0.00ns)   --->   "%indvar_flatten7 = alloca i32 1"   --->   Operation 8 'alloca' 'indvar_flatten7' <Predicate = true> <Delay = 0.00>
ST_1 : Operation 9 [1/1] (0.38ns)   --->   "%store_ln0 = store i5 0, i5 %indvar_flatten7"   --->   Operation 9 'store' 'store_ln0' <Predicate = true> <Delay = 0.38>
ST_1 : Operation 10 [1/1] (0.38ns)   --->   "%store_ln0 = store i3 0, i3 %i"   --->   Operation 10 'store' 'store_ln0' <Predicate = true> <Delay = 0.38>
ST_1 : Operation 11 [1/1] (0.38ns)   --->   "%store_ln0 = store i3 0, i3 %j"   --->   Operation 11 'store' 'store_ln0' <Predicate = true> <Delay = 0.38>
ST_1 : Operation 12 [1/1] (0.00ns)   --->   "%br_ln0 = br void %.preheader.preheader"   --->   Operation 12 'br' 'br_ln0' <Predicate = true> <Delay = 0.00>
ST_1 : Operation 13 [1/1] (0.00ns)   --->   "%indvar_flatten7_load = load i5 %indvar_flatten7" [/home/CryptoHLS/test/aes_raw.cpp:85]   --->   Operation 13 'load' 'indvar_flatten7_load' <Predicate = true> <Delay = 0.00>
ST_1 : Operation 14 [1/1] (0.00ns)   --->   "%specpipeline_ln0 = specpipeline void @_ssdm_op_SpecPipeline, i32 4294967295, i32 0, i32 1, i32 0, void @p_str"   --->   Operation 14 'specpipeline' 'specpipeline_ln0' <Predicate = true> <Delay = 0.00>
ST_1 : Operation 15 [1/1] (0.63ns)   --->   "%icmp_ln85 = icmp_eq  i5 %indvar_flatten7_load, i5 16" [/home/CryptoHLS/test/aes_raw.cpp:85]   --->   Operation 15 'icmp' 'icmp_ln85' <Predicate = true> <Delay = 0.63> <CoreInst = "Cmp">   --->   Core 9 'Cmp' <Latency = 0> <II = 1> <Delay = 0.49> <FuncUnit> <Opcode : 'icmp'> <InPorts = 2> <OutPorts = 1>
ST_1 : Operation 16 [1/1] (0.70ns)   --->   "%add_ln85_1 = add i5 %indvar_flatten7_load, i5 1" [/home/CryptoHLS/test/aes_raw.cpp:85]   --->   Operation 16 'add' 'add_ln85_1' <Predicate = true> <Delay = 0.70> <CoreInst = "Adder">   --->   Core 1 'Adder' <Latency = 0> <II = 1> <Delay = 0.57> <FuncUnit> <Opcode : 'add' 'sub'> <InPorts = 2> <OutPorts = 1>
ST_1 : Operation 17 [1/1] (0.00ns)   --->   "%br_ln85 = br i1 %icmp_ln85, void %.preheader, void %_Z8SubBytesPA4_A4_h.exit43.exitStub" [/home/CryptoHLS/test/aes_raw.cpp:85]   --->   Operation 17 'br' 'br_ln85' <Predicate = true> <Delay = 0.00>
ST_1 : Operation 18 [1/1] (0.00ns)   --->   "%j_load = load i3 %j" [/home/CryptoHLS/test/aes_raw.cpp:86]   --->   Operation 18 'load' 'j_load' <Predicate = (!icmp_ln85)> <Delay = 0.00>
ST_1 : Operation 19 [1/1] (0.00ns)   --->   "%i_load = load i3 %i" [/home/CryptoHLS/test/aes_raw.cpp:85]   --->   Operation 19 'load' 'i_load' <Predicate = (!icmp_ln85)> <Delay = 0.00>
ST_1 : Operation 20 [1/1] (0.57ns)   --->   "%add_ln85 = add i3 %i_load, i3 1" [/home/CryptoHLS/test/aes_raw.cpp:85]   --->   Operation 20 'add' 'add_ln85' <Predicate = (!icmp_ln85)> <Delay = 0.57> <CoreInst = "Adder">   --->   Core 1 'Adder' <Latency = 0> <II = 1> <Delay = 0.57> <FuncUnit> <Opcode : 'add' 'sub'> <InPorts = 2> <OutPorts = 1>
ST_1 : Operation 21 [1/1] (0.49ns)   --->   "%icmp_ln86 = icmp_eq  i3 %j_load, i3 4" [/home/CryptoHLS/test/aes_raw.cpp:86]   --->   Operation 21 'icmp' 'icmp_ln86' <Predicate = (!icmp_ln85)> <Delay = 0.49> <CoreInst = "Cmp">   --->   Core 9 'Cmp' <Latency = 0> <II = 1> <Delay = 0.49> <FuncUnit> <Opcode : 'icmp'> <InPorts = 2> <OutPorts = 1>
ST_1 : Operation 22 [1/1] (0.27ns)   --->   "%select_ln85 = select i1 %icmp_ln86, i3 0, i3 %j_load" [/home/CryptoHLS/test/aes_raw.cpp:85]   --->   Operation 22 'select' 'select_ln85' <Predicate = (!icmp_ln85)> <Delay = 0.27> <CoreInst = "Sel">   --->   Core 73 'Sel' <Latency = 0> <II = 1> <Delay = 0.27> <FuncUnit> <Opcode : 'select'> <InPorts = 3> <OutPorts = 1>
ST_1 : Operation 23 [1/1] (0.27ns)   --->   "%select_ln85_1 = select i1 %icmp_ln86, i3 %add_ln85, i3 %i_load" [/home/CryptoHLS/test/aes_raw.cpp:85]   --->   Operation 23 'select' 'select_ln85_1' <Predicate = (!icmp_ln85)> <Delay = 0.27> <CoreInst = "Sel">   --->   Core 73 'Sel' <Latency = 0> <II = 1> <Delay = 0.27> <FuncUnit> <Opcode : 'select'> <InPorts = 3> <OutPorts = 1>
ST_1 : Operation 24 [1/1] (0.00ns)   --->   "%select_ln85_1_cast = zext i3 %select_ln85_1" [/home/CryptoHLS/test/aes_raw.cpp:85]   --->   Operation 24 'zext' 'select_ln85_1_cast' <Predicate = (!icmp_ln85)> <Delay = 0.00>
ST_1 : Operation 25 [1/1] (0.00ns)   --->   "%trunc_ln87 = trunc i3 %select_ln85" [/home/CryptoHLS/test/aes_raw.cpp:87]   --->   Operation 25 'trunc' 'trunc_ln87' <Predicate = (!icmp_ln85)> <Delay = 0.00>
ST_1 : Operation 26 [1/1] (0.00ns)   --->   "%tmp_19_cast = bitconcatenate i4 @_ssdm_op_BitConcatenate.i4.i2.i2, i2 %trunc_ln87, i2 0" [/home/CryptoHLS/test/aes_raw.cpp:87]   --->   Operation 26 'bitconcatenate' 'tmp_19_cast' <Predicate = (!icmp_ln85)> <Delay = 0.00>
ST_1 : Operation 27 [1/1] (0.70ns)   --->   "%add_ln87 = add i4 %tmp_19_cast, i4 %select_ln85_1_cast" [/home/CryptoHLS/test/aes_raw.cpp:87]   --->   Operation 27 'add' 'add_ln87' <Predicate = (!icmp_ln85)> <Delay = 0.70> <CoreInst = "Adder">   --->   Core 1 'Adder' <Latency = 0> <II = 1> <Delay = 0.57> <FuncUnit> <Opcode : 'add' 'sub'> <InPorts = 2> <OutPorts = 1>
ST_1 : Operation 28 [1/1] (0.00ns)   --->   "%zext_ln87_1 = zext i4 %add_ln87" [/home/CryptoHLS/test/aes_raw.cpp:87]   --->   Operation 28 'zext' 'zext_ln87_1' <Predicate = (!icmp_ln85)> <Delay = 0.00>
ST_1 : Operation 29 [1/1] (0.00ns)   --->   "%state_addr = getelementptr i8 %state, i64 0, i64 %zext_ln87_1" [/home/CryptoHLS/test/aes_raw.cpp:87]   --->   Operation 29 'getelementptr' 'state_addr' <Predicate = (!icmp_ln85)> <Delay = 0.00>
ST_1 : Operation 30 [2/2] (0.66ns)   --->   "%state_load = load i4 %state_addr" [/home/CryptoHLS/test/aes_raw.cpp:87]   --->   Operation 30 'load' 'state_load' <Predicate = (!icmp_ln85)> <Delay = 0.66> <CoreInst = "RAM">   --->   Core 83 'RAM' <Latency = 1> <II = 1> <Delay = 0.66> <Storage> <Opcode : 'load' 'store'> <Ports = 2> <Width = 8> <Depth = 16> <RAM>
ST_1 : Operation 31 [1/1] (0.57ns)   --->   "%add_ln86 = add i3 %select_ln85, i3 1" [/home/CryptoHLS/test/aes_raw.cpp:86]   --->   Operation 31 'add' 'add_ln86' <Predicate = (!icmp_ln85)> <Delay = 0.57> <CoreInst = "Adder">   --->   Core 1 'Adder' <Latency = 0> <II = 1> <Delay = 0.57> <FuncUnit> <Opcode : 'add' 'sub'> <InPorts = 2> <OutPorts = 1>
ST_1 : Operation 32 [1/1] (0.38ns)   --->   "%store_ln85 = store i5 %add_ln85_1, i5 %indvar_flatten7" [/home/CryptoHLS/test/aes_raw.cpp:85]   --->   Operation 32 'store' 'store_ln85' <Predicate = (!icmp_ln85)> <Delay = 0.38>
ST_1 : Operation 33 [1/1] (0.38ns)   --->   "%store_ln85 = store i3 %select_ln85_1, i3 %i" [/home/CryptoHLS/test/aes_raw.cpp:85]   --->   Operation 33 'store' 'store_ln85' <Predicate = (!icmp_ln85)> <Delay = 0.38>
ST_1 : Operation 34 [1/1] (0.38ns)   --->   "%store_ln86 = store i3 %add_ln86, i3 %j" [/home/CryptoHLS/test/aes_raw.cpp:86]   --->   Operation 34 'store' 'store_ln86' <Predicate = (!icmp_ln85)> <Delay = 0.38>

State 2 <SV = 1> <Delay = 1.29>
ST_2 : Operation 35 [1/2] (0.66ns)   --->   "%state_load = load i4 %state_addr" [/home/CryptoHLS/test/aes_raw.cpp:87]   --->   Operation 35 'load' 'state_load' <Predicate = true> <Delay = 0.66> <CoreInst = "RAM">   --->   Core 83 'RAM' <Latency = 1> <II = 1> <Delay = 0.66> <Storage> <Opcode : 'load' 'store'> <Ports = 2> <Width = 8> <Depth = 16> <RAM>
ST_2 : Operation 36 [1/1] (0.00ns)   --->   "%zext_ln87 = zext i8 %state_load" [/home/CryptoHLS/test/aes_raw.cpp:87]   --->   Operation 36 'zext' 'zext_ln87' <Predicate = true> <Delay = 0.00>
ST_2 : Operation 37 [1/1] (0.00ns)   --->   "%sbox_addr = getelementptr i8 %sbox, i64 0, i64 %zext_ln87" [/home/CryptoHLS/test/aes_raw.cpp:87]   --->   Operation 37 'getelementptr' 'sbox_addr' <Predicate = true> <Delay = 0.00>
ST_2 : Operation 38 [2/2] (0.62ns)   --->   "%sbox_load = load i8 %sbox_addr" [/home/CryptoHLS/test/aes_raw.cpp:87]   --->   Operation 38 'load' 'sbox_load' <Predicate = true> <Delay = 0.62> <CoreInst = "ROM">   --->   Core 101 'ROM' <Latency = 1> <II = 1> <Delay = 0.62> <Storage> <Opcode : 'load'> <Ports = 0> <Width = 8> <Depth = 256> <ROM>
ST_2 : Operation 46 [1/1] (0.00ns)   --->   "%ret_ln0 = ret"   --->   Operation 46 'ret' 'ret_ln0' <Predicate = (icmp_ln85)> <Delay = 0.00>

State 3 <SV = 2> <Delay = 1.29>
ST_3 : Operation 39 [1/1] (0.00ns)   --->   "%specloopname_ln0 = specloopname void @_ssdm_op_SpecLoopName, void @VITIS_LOOP_85_1_VITIS_LOOP_86_2_str"   --->   Operation 39 'specloopname' 'specloopname_ln0' <Predicate = true> <Delay = 0.00>
ST_3 : Operation 40 [1/1] (0.00ns)   --->   "%empty = speclooptripcount i32 @_ssdm_op_SpecLoopTripCount, i64 16, i64 16, i64 16"   --->   Operation 40 'speclooptripcount' 'empty' <Predicate = true> <Delay = 0.00>
ST_3 : Operation 41 [1/1] (0.00ns)   --->   "%specpipeline_ln0 = specpipeline void @_ssdm_op_SpecPipeline, i32 4294967295, i32 0, i32 1, i32 0, void @p_str"   --->   Operation 41 'specpipeline' 'specpipeline_ln0' <Predicate = true> <Delay = 0.00>
ST_3 : Operation 42 [1/1] (0.00ns)   --->   "%specloopname_ln86 = specloopname void @_ssdm_op_SpecLoopName, void @empty_5" [/home/CryptoHLS/test/aes_raw.cpp:86]   --->   Operation 42 'specloopname' 'specloopname_ln86' <Predicate = true> <Delay = 0.00>
ST_3 : Operation 43 [1/2] (0.62ns)   --->   "%sbox_load = load i8 %sbox_addr" [/home/CryptoHLS/test/aes_raw.cpp:87]   --->   Operation 43 'load' 'sbox_load' <Predicate = true> <Delay = 0.62> <CoreInst = "ROM">   --->   Core 101 'ROM' <Latency = 1> <II = 1> <Delay = 0.62> <Storage> <Opcode : 'load'> <Ports = 0> <Width = 8> <Depth = 256> <ROM>
ST_3 : Operation 44 [1/1] (0.66ns)   --->   "%store_ln87 = store i8 %sbox_load, i4 %state_addr" [/home/CryptoHLS/test/aes_raw.cpp:87]   --->   Operation 44 'store' 'store_ln87' <Predicate = true> <Delay = 0.66> <CoreInst = "RAM">   --->   Core 83 'RAM' <Latency = 1> <II = 1> <Delay = 0.66> <Storage> <Opcode : 'load' 'store'> <Ports = 2> <Width = 8> <Depth = 16> <RAM>
ST_3 : Operation 45 [1/1] (0.00ns)   --->   "%br_ln0 = br void %.preheader.preheader"   --->   Operation 45 'br' 'br_ln0' <Predicate = true> <Delay = 0.00>


============================================================
+ Verbose Summary: Timing violations
============================================================
Target clock period: 10ns, clock uncertainty: 2.7ns.

 <State 1>: 2.22ns
The critical path consists of the following:
	'alloca' operation ('i') [4]  (0 ns)
	'load' operation ('i_load', /home/CryptoHLS/test/aes_raw.cpp:85) on local variable 'i' [18]  (0 ns)
	'add' operation ('add_ln85', /home/CryptoHLS/test/aes_raw.cpp:85) [19]  (0.572 ns)
	'select' operation ('select_ln85_1', /home/CryptoHLS/test/aes_raw.cpp:85) [24]  (0.278 ns)
	'add' operation ('add_ln87', /home/CryptoHLS/test/aes_raw.cpp:87) [29]  (0.708 ns)
	'getelementptr' operation ('state_addr', /home/CryptoHLS/test/aes_raw.cpp:87) [31]  (0 ns)
	'load' operation ('state_load', /home/CryptoHLS/test/aes_raw.cpp:87) on array 'state' [33]  (0.667 ns)

 <State 2>: 1.29ns
The critical path consists of the following:
	'load' operation ('state_load', /home/CryptoHLS/test/aes_raw.cpp:87) on array 'state' [33]  (0.667 ns)
	'getelementptr' operation ('sbox_addr', /home/CryptoHLS/test/aes_raw.cpp:87) [35]  (0 ns)
	'load' operation ('sbox_load', /home/CryptoHLS/test/aes_raw.cpp:87) on array 'sbox' [36]  (0.626 ns)

 <State 3>: 1.29ns
The critical path consists of the following:
	'load' operation ('sbox_load', /home/CryptoHLS/test/aes_raw.cpp:87) on array 'sbox' [36]  (0.626 ns)
	'store' operation ('store_ln87', /home/CryptoHLS/test/aes_raw.cpp:87) of variable 'sbox_load', /home/CryptoHLS/test/aes_raw.cpp:87 on array 'state' [37]  (0.667 ns)


============================================================
+ Verbose Summary: Binding
============================================================
N/A
* FSMD analyzer results:
  - Output states:
 - Input state : 
  - Chain level:
	State 1
	State 2
	State 3


============================================================
+ Verbose Summary: Datapath Resource usage 
============================================================
N/A
